pid,label,label_en,label_es,label_fr,link,section,genre,claimed_genre,claimed_genre_en,claimed_genre_es,claimed_genre_fr,access,status,language,creators,stewards,blurb_orig,blurb_en,blurb_es,blurb_fr,related_to,added_by,twitter,census_year,notes
cds159,thepostarchive,,el pos-archivo,,https://youtube.com/c/thepostarchive,Collections & Curations,Thematic Curations,archive,an archive,un archivo,,open,Active,"en,es,fr",,,Youtube channel that tends to have many Carribbean writers and artists featured on it.,"Curating and releasing rare recordings into the world. Vintage radio, poets and writers reading their works, interviews, jazz, and more. This channel receives no monetary compensation from, nor is it affiliated with any institutions or nonprofits. Any ads are due to copyright claims on the videos. The Youtube channel tends to have many Carribbean writers and artists featured on it.","Curando y lanzando grabaciones raras al mundo: Radio de antaño, poetas y escritores leyendo sus obras, entrevistas, jazz y más. Este canal de Youtube tiende a tener muchos escritores y artistas caribeños invitados.",,,,,2020,
cds162,Traveling Caribbean Heritage,,Patrimonio itinerante del Caribe,,https://www.kitlv.nl/traveling-caribbean-heritage/,Collections & Curations,Thematic Curations,exhibit,an exhibit,una exposición,,open,In Development,"en,nl",Rose Mary Allen et al. ,KITLV/Royal Netherlands Institute of Southeast Asian and Caribbean Studies,"In this project, Caribbean and Dutch scholars and cultural heritage specialists address these questions, identifying and questioning the dynamics of heritage formation, and developing a multi-generational human resource base as well as a digital infrastructure for the preservation of insular cultural heritage, for outreach activities, and ultimately for stimulating the sustainable development of these non-sovereign SIDS.","In this project, Caribbean and Dutch scholars and cultural heritage specialists address these questions, identifying and questioning the dynamics of heritage formation, and developing a multi-generational human resource base as well as a digital infrastructure for the preservation of insular cultural heritage, for outreach activities, and ultimately for stimulating the sustainable development of these non-sovereign SIDS.","En este proyecto, los estudiosos caribeños y holandeses y los especialistas del patrimonio cultural abordan estas preguntas, identificando y cuestionando la dinámica de la formación del patrimonio y desarrollo de una base de recursos humanos multi-generacional, así como una infraestructura digital para la preservación del patrimonio cultural insular, y, en última instancia, para estimular el desarrollo sostenible de estos territorios no soberanos.",,,Roopika Risam,@roopikarisam,2020,
cds163,The Puerto Rico Citizenship Archives Project,,El Proyecto de Archivos de Ciudadanía de Puerto Rico,,https://scholarscollaborative.org/PuertoRico/,Collections & Curations,Thematic Curations,digital archive,a digital archive,un archivo digital,,open,Stable,en,Charles R. Venator-Santiago ,University of Connecticut,The Puerto Rico Citizenship Archives Project (PRCAP) is part of a public repository designed to document the legal history of the extension of citizenship to the U.S. territories. The PRCAP provides a comprehensive overview of 120+ year story of debates over the extension of citizenship to Puerto Rico. It also provides public access to the key historical documents shaping this history. The main goal is to create a reliable public archive of primary documents that can foster new research projects on Puerto Rico and its relationship to the United States as well as on broader visions of U.S. citizenship.,The Puerto Rico Citizenship Archives Project (PRCAP) is part of a public repository designed to document the legal history of the extension of citizenship to the U.S. territories. The PRCAP provides a comprehensive overview of 120+ year story of debates over the extension of citizenship to Puerto Rico. It also provides public access to the key historical documents shaping this history. The main goal is to create a reliable public archive of primary documents that can foster new research projects on Puerto Rico and its relationship to the United States as well as on broader visions of U.S. citizenship.,"El Proyecto de Archivos de Ciudadanía de Puerto Rico (PRCAP) es parte de un repositorio público diseñado para documentar el historial legal de la extensión de la ciudadanía a los territorios de los Estados Unidos. El PRCAP proporciona una descripción general completa de 120 años de historia de debates sobre la extensión de la ciudadanía a Puerto Rico. También proporciona acceso público a los documentos históricos clave que conforman esta historia. El objetivo principal es crear un archivo público confiable de documentos primarios que puedan fomentar nuevos proyectos de investigación sobre Puerto Rico y su relación con los Estados Unidos, así como en las visiones más amplias de la ciudadanía de los Estados Unidos.",,,,,2020,
cds168,Manioc,,,Manioc,http://www.manioc.org/,Collections & Curations,Digital Libraries,digital library,a digital library,una biblioteca digital,une bibliothèque numérique,open,Active,fr,,"Université des Antilles, L'Université de Guyane","Manioc est une bibliothèque numérique spécialisée sur la Caraïbe, l'Amazonie, le Plateau des Guyanes et les régions ou centres d'intérêt liés à ces territoires. Vous y trouverez des documents textuels, sonores, iconographiques et des références concernant l'histoire culturelle, sociale, économique ou politique de ces pays.","Manioc is a digital library specializing in the Caribbean, the Amazon, the Guyana Plateau and the regions or centers of interest linked to these territories. You will find there textual, sound, iconographic documents and references concerning the cultural, social, economic or political history of these countries.","Manioc es una biblioteca digital especializada en el Caribe, la Amazonía, la meseta de Guyana y las regiones o centros de interés vinculados a estos territorios. Allí encontrará documentos y referencias textuales, sonoras, iconográficas sobre la historia cultural, social, económica o política de estos países.",,,,,2020,
cds17,Banque Numérique des Patrimoines Martiniquais,Digital Repository of Martinique's Patrimony,Repositorio digital del patrimonio martiniqués,,https://www.patrimoines-martinique.org/,Collections & Curations,Digital Libraries,banque numérique,a digital repository,un repositorio digital,,open,Active,fr,,,"Initiated by the former General Council of Martinique, the Banque Numérique des Patrimoines Martiniquais is an access portal to documentary resources on the cultural and historical heritage of Martinique backed by the geographic information system of Martinique (SIGMA).","Initiated by the former General Council of Martinique, the Banque Numérique des Patrimoines Martiniquais is an access portal to documentary resources on the cultural and historical heritage of Martinique backed by the geographic information system of Martinique (SIGMA).","Iniciado por el ex Consejo General de Martinica, el Banque Numérique des Patrimoines Martiniquais es un portal de acceso a los recursos documentales sobre el patrimonio cultural e histórico de Martinica respaldados por el Sistema de Información Geográfica de Martinica (SIGMA).",,,,,2020,
cds170,"Documentation of the Sidney Martin Library Art Collection, UWI (Cave Hill Campus)",,,,https://heritedge.foundation/processing-and-documenting-the-sidney-martin-library-art-collection/,Collections & Curations,Thematic Curations,documentation,documentation,,,private,In Development,en,Amalia S. Levi,,"Project to document the Sidney Martin Library collection with archival material and photos. Public-facing omeka site created, but not yet activated.","Project to document the Sidney Martin Library collection with archival material and photos. Public-facing omeka site created, but not yet activated.",,,,Amalia S. Levi,@amaliasl,2020,
cds171,Archivo General de la Nación: Collectiones Digitales,,Revista ARC,,http://colecciones.agn.gob.do/opac/index.php?codopac=OPPUB,Collections & Curations,Digital Libraries,colección digital,a digital collection,una colección digital,,open,Stable,es,,Archivo Nacional de la Nación,Servicio de consulta de documentos mediante software de gestión archivística que facilita el acceso a las informaciones contenidas en los fondos y colecciones documentales digitalizados en el AGN.,"The General Archive of the Nation is the main archival institution in the Dominican Republic, where documents dating from the founding of the Republic and others inherited from the colonial era are kept, which form a significant part of the Dominican documentary heritage. This portal offers a document consultation service that facilitates access to the information contained in the archives and to the documentary digitized collections of the AGN.","El AGN es la principal institución archivística del país, donde se custodian documentos que datan de la fundación de la República y otros heredados de la época colonial, que forman una parte significativa del patrimonio documental dominicano. Este portal ofrece un servicio de consulta de documentos mediante software de gestión archivística que facilita el acceso a las informaciones contenidas en los fondos y colecciones documentales digitalizados en el AGN.",,,Alex Gil,@elotroalex,2021,
cds173,The Things We Carried,,,,https://www.saada.org/thethingswecarried,Collections & Curations,Thematic Curations,digital archive and multimedia exhibit,digital archive and multimedia exhibit,un archivo digital y una exposición multimedia,,open,Active,en,Gaiutra Bahadur,The South Asian American Digital Archive (SAADA),"A collection of oral histories, photographs, documents, ephemera, poetry, and essays documenting the migration of Guyanese rooted in indenture to the United States and tracing black-brown relationships and solidarities, dating to the era of American nativist exclusion. Created with the South Asian American Digital Archive (SAADA), through an Andrew W. Mellon Foundation-funded fellowship for creating community-based archives.","A collection of oral histories, photographs, documents, ephemera, poetry, and essays documenting the migration of Guyanese rooted in indenture to the United States and tracing black-brown relationships and solidarities, dating to the era of American nativist exclusion. Created with the South Asian American Digital Archive (SAADA), through an Andrew W. Mellon Foundation-funded fellowship for creating community-based archives.","Una colección de historias orales, fotografías, documentos, efímeros, poesía y ensayos que documentan la migración de Guyaneses arraigados en el contrato de trabajo sin paga a los Estados Unidos, y rastrear relaciones y solidaridades de Negros y sud-asiaticos, que datan de la era de la exclusión nativista estadounidense. Creado con el Archivo Digital Americano Asiático del Sur (SAADA), a través de una beca financiada por la Fundación Andrew W. Mellon para crear archivos basados ​​en las contribuciones comunitarias.",,,Gaiutra Bahadur,@gbahadur,2021,
cds177,Rendering Revolution,,Representando la revolución,,https://renderingrevolution.ht/,Collections & Curations,Thematic Curations,sartorial approaches,sartorial approaches,enfoques sartoriales,,open,Active,"en,ht","Siobhan Meï, Jonathan Square, et al",,Rendering Revolution: Sartorial Approaches to Haitian History is a digital humanities project and educational tool that documents the significant role that fashion and clothing played in constructing visions of freedom during and after the Haitian Revolution.,Rendering Revolution: Sartorial Approaches to Haitian History is a digital humanities project and educational tool that documents the significant role that fashion and clothing played in constructing visions of freedom during and after the Haitian Revolution.,&quot;Rendering Revolution: Sartorial Approaches to Haitian History&quot; (Revolución de la representación: enfoques sartoriales para la historia haitiana) es un proyecto de humanidades digitales y una herramienta educativa que documenta el importante papel que desempeñan la moda y la ropa en la construcción de visiones de libertad durante y después de la revolución haitiana.,,,Alex Gil,@elotroalex,2021,
cds178,Haiti Digital Library,,Biblioteca digital de Haití,,https://sites.duke.edu/haitilab/,Collections & Curations,Thematic Curations,digital library,a digital library,una biblioteca digital,,open,In Development,"en,ht,fr",Haiti Laboratory at Duke University,Haiti Laboratory at Duke University,"This site, produced by Duke’s Haiti Lab, is meant to serve as a guide and portal to online resources about Haiti, specifically historical materials relating to the country and writings by Haitian authors. It is geared towards providing maximum access to these resources to Haitian readers. It is a work in progress: there is sometimes a lag between uploading documents in English and translating the material into the other languages. We welcome your comments about the organization of the site, as well as suggestions for materials you would like to see digitized and made available online.","This site, produced by Duke’s Haiti Lab, is meant to serve as a guide and portal to online resources about Haiti, specifically historical materials relating to the country and writings by Haitian authors. It is geared towards providing maximum access to these resources to Haitian readers. ","Este sitio, producido por el laboratorio de Haití de la universidad de Duke, está destinado a servir como guía y portal a recursos en línea sobre Haití, específicamente materiales históricos relacionados con el país y escritos por los autores haitianos. Está orientado a proporcionar el máximo acceso a estos recursos a los lectores haitianos. ",,,Alex Gil,@elotroalex,2021,
cds18,Biblioteca Nacional Aruba: Coleccion Digital,Aruba National Library: Digital Collection,,,https://digital.bna.aw,Collections & Curations,Digital Libraries,colección digital,unaa colección digital,a digital collection,,open,Active,"pap, en, es, nl",Biblioteca Nacional Aruba,Internet Archive,Digital Collection of the Aruba National Library.,Digital Collection of the Aruba National Library.,Colección digital de la Biblioteca Nacional de Aruba.,,,Alex Gil,@elotroalex,2020,
cds180,Fanm Rebèl,Rebel Women,Mujer Rebelde,Femme Rebelle,https://www.fanmrebel.com/,Collections & Curations,Thematic Curations,"co-curated open access digital archive, gallery, resource centre and hub of expertise and further learning","a co-curated open access digital archive, gallery, resource centre and hub of expertise and further learning","archivo digital, galería, centro de recursos y centro de especialización y aprendizaje continuo de acceso abierto y co-curado",,open,In Development,en,[A network],,"‘Fanm Rebèl’, a Haitian Kreyòl term meaning ‘rebel women’, is a 3-year research project sponsored by the Leverhulme Trust and the Institute for Black Atlantic Research at the University of Central Lancashire. Led by Dr Nicole Willson, the project seeks to excavate stories of women in the Haitian Revolution. Spanning a 100-year trajectory, from 1750-1850, it broadens the conventional scope of the Haitian revolutionary calendar to encompass the radical acts of female insurgency and marronage that predate the Ogé Rebellion of 1790 and the insurgency of 1791, and extends beyond the birth of the Haitian Republic in 1804 to encompass the life cycle of Marie-Louise Christophe, first Queen of Haiti. It explores narratives of resistance articulated through spiritual practice, domestic labour, creativity, survival, subterfuge and armed combat. ","‘Fanm Rebèl’, a Haitian Kreyòl term meaning ‘rebel women’, is a 3-year research project sponsored by the Leverhulme Trust and the Institute for Black Atlantic Research at the University of Central Lancashire. Led by Dr Nicole Willson, the project seeks to excavate stories of women in the Haitian Revolution. Spanning a 100-year trajectory, from 1750-1850, it broadens the conventional scope of the Haitian revolutionary calendar to encompass the radical acts of female insurgency and marronage that predate the Ogé Rebellion of 1790 and the insurgency of 1791, and extends beyond the birth of the Haitian Republic in 1804 to encompass the life cycle of Marie-Louise Christophe, first Queen of Haiti. It explores narratives of resistance articulated through spiritual practice, domestic labour, creativity, survival, subterfuge and armed combat. ","Fanm Rebèl', un término haitiano Kreyòl que significa 'Mujer rebelde', es un proyecto de investigación de 3 años patrocinado por el fondo de Leverhulme y el Instituto de Investigación Atlántico Negra en la Universidad de Central Lancashire (Inglaterra). Dirigido por la Dra. Nicole Willson, el proyecto busca excavar historias de mujeres en la Revolución Haitiana. Abarcando una trayectoria de 100 años, desde 1750-1850, amplía el alcance convencional del calendario revolucionario haitiano para abarcar los actos radicales de insurgencia y marronaje femenino que anteceden a la rebelión de Ogé de 1790 y la insurgencia de 1791, y se extiende más allá del nacimiento de la República Haitiana en 1804 para abarcar el ciclo de vida de Marie-Louise Christophe, la primera reina de Haití. Explora las narrativas de resistencia articuladas a través de la práctica espiritual, el trabajo doméstico, la creatividad, la supervivencia, el subterfugio y el combate armado.",,,Alex Gil,@elotroalex,2021,
cds182,I Am Taíno,,soy taino,,https://www.harukasakaguchi.com/original-new-yorkers,Collections & Curations,Thematic Curations,portrait series,a portrait series,serie de retratos,,open,Stable,en,Haruka Sakaguchi,,"""I Am Taíno"" is a portrait series addressing paper genocide and the manipulation of Taíno identity. The Taíno are the indigenous peoples of the Spanish-speaking Caribbean who were believed to be extinct up until recently, partly because the racial category for being indigenous (""indio"") was removed from census reports in the early 1800s, and they were forced to identify as either white, black or mixed on forthcoming census reports. The Taíno refer to this process as ""paper genocide.""","&quotI Am Taíno&quot is a portrait series addressing paper genocide and the manipulation of Taíno identity. The Taíno are the indigenous peoples of the Spanish-speaking Caribbean who were believed to be extinct up until recently, partly because the racial category for being indigenous (&quotindio&quot) was removed from census reports in the early 1800s, and they were forced to identify as either white, black or mixed on forthcoming census reports. The Taíno refer to this process as &quotpaper genocide.&quot","&quot;Soy taíno&quot; es una serie de retratos que aborda el genocidio documental, y la manipulación de la identidad Taína. El Taíno son los pueblos indígenas del Caribe de habla hispana que se creían extintos hasta hace poco, en parte porque la categoría racial de indígena (&quot;Indio&quot;) se eliminó de los informes del censo a principios del siglo XIX, y se vieron obligados a identificarse como blancos, negros o mezclas en los próximos informes del censo. Soy Taíno se refiere a este proceso como &quot;genocidio documental&quot;.",,,Alex Gil,@elotroalex,2021,
cds184,A History of Dominican Music in the United States,,,,http://dominicanmusicusa.com/,Collections & Curations,Thematic Curations,resource for exploring historical map images,a resource for exploring historical map images,un recurso para explorar imágenes de mapas históricas,,open,,,,,,"A History of Dominican Music in the U.S. is the first open-source digital tool narrating the history of Dominican music as it developed during the past century in the United States. By presenting multi-media resources, grounded in historical contexts and speaking to larger issues of immigration, identity, and diversity, this online platform provides a new approach to understanding Dominican music.","Una historia de la música dominicana en los EE. UU. Es la primera herramienta digital de acceso abierto que narra la historia de la música dominicana a medida que se desarrolló durante el siglo pasado en los Estados Unidos. Al presentar recursos multimedia, basados en contextos históricos y hablar sobre temas más amplios de inmigración, identidad y diversidad, esta plataforma en línea brinda un nuevo enfoque para comprender la música dominicana.",,,,,2021,
cds185,Ro(u)ted by Our Stories,,Enrutado por nuestras historias,,https://www.indocaribbeanstories.org/,Collections & Curations,Thematic Curations,intergenerational oral history archive,an intergenerational oral history archive,un archivo de historia oral intergeneracional,,open,Active,en,[The Team],[The Team],"Ro(u)ted By Our Stories is an intergenerational oral history archive dedicated to capturing, preserving and sharing the stories of the Indo-Caribbean diaspora's silenced voices. This archive works to center the stories of womxn and gender expansive folx at various intersections of identity including but not limited to those who identify as LGBTQIA+, mixed-race, Muslim, and/or working class. It is a living, growing archive of stories from communities who have inherited the legacies of indenture, rooted in histories and traditions of oral storytelling. In the tradition of Indo-Caribbean feminist thinkers and inspired by the work of diasporic writers like Paul Gilroy, we are inspired to document our heritage (“roots”) but also our migration stories (“routes”)","&quot;Ro(u)ted By Our Stories&quot; is an intergenerational oral history archive dedicated to capturing, preserving and sharing the stories of the Indo-Caribbean diaspora's silenced voices. This archive works to center the stories of womxn and gender expansive folx at various intersections of identity including but not limited to those who identify as LGBTQIA+, mixed-race, Muslim, and/or working class. It is a living, growing archive of stories from communities who have inherited the legacies of indenture, rooted in histories and traditions of oral storytelling. In the tradition of Indo-Caribbean feminist thinkers and inspired by the work of diasporic writers like Paul Gilroy, we are inspired to document our heritage (“roots”) but also our migration stories (“routes”)","&quot;Ro(u)ted By Our Stories&quot; (Enrutados por nuestras historias) es un archivo de historia oral intergeneracional dedicado a capturar, preservar y compartir las historias de las voces silenciadas de la diáspora del Indo-Caribe. Este archivo centraliza las historias de varias intersecciones de identidad, incluidas, entre otras, las personas que se identifican como LGBTQIA+, de raza mixta, los musulmanes y/o la clase obrera. Es un archivo vivo y creciente de historias de las comunidades que han heredado los legados del trabajo por contrato sin paga, arraigados en historias y tradiciones de narración oral. Siiguiendo la tradición de pensadores feministas indo-caribeñas e inspirados en el trabajo de los escritores diáspóricos como Paul Gilroy, documentamos nuestro patrimonio (&quot;raíces&quot;), pero también nuestras historias de migración (&quot;rutas&quot;)",,,Alex Gil,@elotroalex,2021,https://www.instagram.com/routedbyourstories/
cds186,The Oviedo Project at Vassar,,,,https://pages.vassar.edu/oviedo/gonzalo-fernandez-de-oviedo/,Collections & Curations,Scholarly Editions,a collaborative digital translation and scholarly project,a collaborative digital translation and scholarly project,una traducción digital colaborativa y un proyecto académico,,open,Active,en,,,,"The Oviedo Project is a collaborative digital translation and scholarly project that aims at producing a complete English translation of the complete text of Gonzalo Fernández de Oviedo’s Historia General de las Indias, the first ever. Produced by Vassar students, it will result in a full translation into English of the complete text, as well as critical and interpretative material. The translation and annotation work will bring together the editors and Vassar students in collaborative scholarly work.","El Proyecto Oviedo es un proyecto académico y de traducción digital colaborativa que tiene como objetivo producir una traducción completa al inglés del texto completo de la <em>Historia General de las Indias</em> de Gonzalo Fernández de Oviedo, por primera vez en la historia. Producido por estudiantes de Vassar, resultará en una traducción completa al inglés del texto integral, así como material crítico e interpretativo. El trabajo de traducción y anotación reunirá a los editores y estudiantes de Vassar en un trabajo académico colaborativo.",,,,,2021,
