pid,label,label_en,label_es,label_fr,link,section,genre,claimed_genre,claimed_genre_en,claimed_genre_es,claimed_genre_fr,access,status,language,creators,stewards,blurb_orig,blurb_en,blurb_es,blurb_fr,related_to,added_by,twitter,census_year,notes
cds83,Haiti and the Atlantic World,,,,https://haitidoi.com/,Collections & Curations,Thematic Curations,website,un website,un sitio web,,open,Stable,en,Julia Gaffield,,This website seeks to encourage the discussion about Haiti’s founding documents and their influences on the broader Atlantic.,This website seeks to encourage the discussion about Haiti’s founding documents and their influences on the broader Atlantic.,Este sitio web busca fomentar la discusión sobre los documentos fundadores de Haití y sus influencias en el Atlántico más amplio.,,,Alex Gil,@elotroalex,2020,
cds84,John Carter Brown Library Haiti Collection,,Colección Haití de la biblioteca John Carter Brown,,https://archive.org/details/jcbhaiti,Collections & Curations,Thematic Curations,digital collection,a digital collection,una colección digital,,open,Active,"en,fr",,Brown University,"Our rare books, maps and newspapers tell the story of the founding of the French colony of Saint Domingue (once the most lucrative colony in the Americas), its demise through the Haitian Revolution (the world's only successful slave revolution) and the founding of Haiti in its place.","Our rare books, maps and newspapers tell the story of the founding of the French colony of Saint Domingue (once the most lucrative colony in the Americas), its demise through the Haitian Revolution (the world's only successful slave revolution) and the founding of Haiti in its place.","Nuestros libros unicos, mapas y periódicos cuentan la historia de la fundación de la colonia francesa de Saint Domingue (una vez la colonia más lucrativa de las Américas), su desaparición a causa de la revolución haitiana (la única revolución esclava exitosa del mundo) y la fundación de Haití en su lugar.",,,Roopika Risam,@roopikarisam,2020,
cds86,Haiti an Island Luminous,,,,http://islandluminous.fiu.edu/index-english.html,Collections & Curations,Thematic Curations,a site ,a site ,un sitio,,open,Stable,en,Adam M. Silvia and Brooke Wooldridge ,FIU,"An Island Luminous is a site to help readers learn about Haiti’s history. Created by historian Adam M. Silvia and hosted online by Digital Library of the Caribbean, An Island Luminous combines rare books, manuscripts, and photos scanned by archives and libraries in Haiti and the United States with commentary by over one hundred (100) authors from universities around the world.","An Island Luminous is a site to help readers learn about Haiti’s history. Created by historian Adam M. Silvia and hosted online by Digital Library of the Caribbean, An Island Luminous combines rare books, manuscripts, and photos scanned by archives and libraries in Haiti and the United States with commentary by over one hundred (100) authors from universities around the world.","""An Island Luminous"" (Una Isla luminosa) es un sitio web sobre la historia de Haití. Creado por el historiador Adam M. Silvia y organizado en línea por la Biblioteca Digital del Caribe (dLOC), ""Una Isla luminosa"" combina libros raros, manuscritos y fotos escaneadas por archivos y bibliotecas en Haití y los Estados Unidos con comentarios de más de cien (100) investigadores provenientes de universidades de todo el mundo.",,,Alex Gil,@elotroalex,2020,
cds88,Musical Passage,,,,http://www.musicalpassage.org/,Collections & Curations,Scholarly Editions,exhibit,an exhibit,una exposición,,open,Active,en,"Mary Caton Lingold, David Garner, Laurent Dubois","Scholars & Publics, Duke University","Developed by historian Laurent Dubois, PhD candidate in English Mary Caton Lingold, and composer-scholar David Garner, Musical Passage uses a digital format to explore a unique artifact of early African diasporic music. The site is designed around two pages from eighteenth-century British naturalist and collector Hans Sloane’s A Voyage to the Islands (1707), which documents his time in Jamaica in the late 1680s. The pages of Voyage that have been placed at the center of this site present notation of songs played at a “festival.” This material is precious and fascinating, representing the earliest notation we have of music produced by enslaved Africans in the Caribbean or North America. The performers whose music is represented and interpreted here were likely survivors of the Middle Passage who may have been playing music they had learned in their homelands. They may also have been in the process of creating entirely new performance traditions.","Developed by historian Laurent Dubois, PhD candidate in English Mary Caton Lingold, and composer-scholar David Garner, Musical Passage uses a digital format to explore a unique artifact of early African diasporic music. The site is designed around two pages from eighteenth-century British naturalist and collector Hans Sloane’s <em>A Voyage to the Islands</em> (1707), which documents his time in Jamaica in the late 1680s. The pages of Voyage that have been placed at the center of this site present notation of songs played at a “festival.” This material is precious and fascinating, representing the earliest notation we have of music produced by enslaved Africans in the Caribbean or North America. The performers whose music is represented and interpreted here were likely survivors of the Middle Passage who may have been playing music they had learned in their homelands. They may also have been in the process of creating entirely new performance traditions.","Desarrollado por el historiador Laurent Dubois, la candidata a PhD en Inglés Mary Caton Lingold, y el compositor-erúdito David Garner, ""Musical Passage"" (Pasaje musical) utiliza un formato digital para explorar un artefacto único de la música de la diáspora africana temprana. El sitio está diseñado alrededor de dos páginas de <em>A Voyage to the Islands</em> (Un Viaje a las islas, 1707) del naturalista y coleccionista británico del siglo XVIII, Hans Sloane, que documenta su tiempo en Jamaica a fines de 1680. Las páginas de viaje que se han colocado en el centro de este sitio, presenta notación de canciones interpretadas en un &quot;Festival&quot;. Este material es precioso y fascinante, y representa la notación más temprana que tenemos de música producida por africanos esclavizados en el Caribe o América del Norte. Los intérpretes cuya música está representada e interpretada aquí fueron probablemente sobrevivientes del Pasaje del Medio, y junto a ellos, música que habían aprendido en sus países de origen.",,,Alex Gil,@elotroalex,2020,Can't copy text from the original site.
cds89,Legacies of British Slave-ownership,,,,https://www.ucl.ac.uk/lbs//,Collections & Curations,Thematic Curations,database,a database,una base de datos,,open,Active,en,Matthew Smith et al.,University College London,"Colonial slavery shaped modern Britain and we all still live with its legacies. The slave-owners were one very important means by which the fruits of slavery were transmitted to metropolitan Britain. We believe that research and analysis of this group are key to understanding the extent and the limits of slavery's role in shaping British history and leaving lasting legacies that reach into the present. The stories of enslaved men and women, however, are no less important than those of slave-owners, and we hope that the database produced in the first two phases of the project, while at present primarily a resource for studying slave-owners, will also provide information of value to those researching enslaved people.","Colonial slavery shaped modern Britain and we all still live with its legacies. The slave-owners were one very important means by which the fruits of slavery were transmitted to metropolitan Britain. We believe that research and analysis of this group are key to understanding the extent and the limits of slavery's role in shaping British history and leaving lasting legacies that reach into the present. The stories of enslaved men and women, however, are no less important than those of slave-owners, and we hope that the database produced in the first two phases of the project, while at present primarily a resource for studying slave-owners, will also provide information of value to those researching enslaved people.","La esclavitud colonial formó la Gran Bretaña moderna y todos vivimos con sus legados. Los propietarios de esclavos fueron un medio muy importante por el cual los frutos de la esclavitud se transmitieron a la Gran Bretaña metropolitana. Creemos que la investigación y el análisis de este grupo son clave para comprender la extensión y los límites del papel de la esclavitud en la configuración de la historia británica y los legados perdurables que alcanzan al presente. Las historias de hombres y mujeres esclavizados, sin embargo, no son menos importantes que los de los propietarios de esclavos, y esperamos que la base de datos producida en las dos primeras fases del proyecto, mientras que en la actualidad principalmente es un recurso para estudiar a los propietarios de esclavos, también pueda proporcionar información de valor a aquellos que investigan personas esclavizadas.",,,Roopika Risam,@roopikarisam,2020,"Are we cool with projects by the colonizers? 
😂 "
cds9,Antologías del Pensamiento Social Latinoamericano y Caribeño ,Anthology of Latin-American and Caribbean Social Thought,,,https://www.clacso.org.ar/antologias/index.php,Collections & Curations,Thematic Curations,antología,an anthology,una antología,,open,Stable,es,,,The collection Anthologies of Latin American and Caribbean Social Thought is a CLACSO publishing undertaking aimed at promoting access to the work of some of the most prominent authors of the social sciences in Latin America and the Caribbean.,"The collection ""Anthologies of Latin American and Caribbean Social Thought"" is a CLACSO publishing undertaking aimed at promoting access to the work of some of the most prominent authors of the social sciences in Latin America and the Caribbean.","La colección ""Antologías del Pensamiento Social Latinoamericano y Caribeño"" es un emprendimiento editorial de CLACSO destinado a promover el acceso a la obra de algunos de los más destacados autores de las ciencias sociales de América Latina y el Caribe.",,,,,2020,
cds90,Haitian Art: a Digital Crossroads,,,,https://hadc.sites.grinnell.edu/,Collections & Curations,Thematic Curations,grant project,a grant project,un proyecto de subvención,,private,In Development,en,"Fredo Rivera, Petrouchka Moïse",Grinnell College; Waterloo Center for the Arts,"This project is planning the creation of publicly accessible database for the Waterloo Center for the Arts, which hosts the largest public collection of Haitian art outside Haiti. We are also working on expanding digital resources regarding Haitian art.","This project is planning the creation of publicly accessible database for the Waterloo Center for the Arts, which hosts the largest public collection of Haitian art outside Haiti. We are also working on expanding digital resources regarding Haitian art.","Este proyecto está planeando la creación de una base de datos accesible públicamente para el Centro Waterloo para las Artes, que alberga la mayor colección pública de arte haitiano fuera de Haití. También estamos trabajando en la expansión de los recursos digitales con respecto al arte haitiano.",,,,,2020,
cds91,La Revista América Negra,Black America Journal,,,https://www.javeriana.edu.co/ins-genetica/investigacion/publicaciones/libros/america-negra,Collections & Curations,Thematic Curations,publicaciones,publicaciones,publicaciones,,open,Active,"es,en,fr,de,it,pt",Nina de Friedemann,Pontificia Universidad Javeriana Bogotá,The América Negra Magazine was a biannual publication of the Human Expedition that contained materials on any of the disciplines that deal with the description and analysis of human populations. The Magazine emphasized the black and indigenous communities of the American continent and their relationships with populations from other parts of the world.,The América Negra Magazine was a biannual publication of the Human Expedition that contained materials on any of the disciplines that deal with the description and analysis of human populations. The Magazine emphasized the black and indigenous communities of the American continent and their relationships with populations from other parts of the world.,La revista América Negra fue una publicación bianual de la expedición humana que contenía materiales sobre cualquiera de las disciplinas que tratan la descripción y el análisis de las poblaciones humanas. La revista enfatizó las comunidades negras e indígenas del continente estadounidense y sus relaciones con las poblaciones de otras partes del mundo.,,,,,2020,
cds92,Caribbean Sexualities: Love | Hope | Community: Sexualities & Social Justice in the Caribbean,,,,http://caribbeansexualities.org/,Collections & Curations,Thematic Curations,online collection,an online collection,una colección en línea,,open,Stable,en,"Rosamond S. King, Angelique V. Nixon",Caribbean International Resource Network (IRN) and Sargasso journal,"This collection focusing on Caribbean Sexualitities and Social Justice across the region offers a space for reflection, sharing, and exchange. We feature related content already published in print but published online for the first time, alongside new materials and resources.","This collection focusing on Caribbean Sexualitities and Social Justice across the region offers a space for reflection, sharing, and exchange. We feature related content already published in print but published online for the first time, alongside new materials and resources.","Esta colección, centrada en las sexualidades del Caribe y la justicia social en toda la región, ofrece un espacio para la reflexión, y el intercambio. Presentamos contenido relacionado ya publicado en formato impreso, pero publicado en línea por primera vez, junto con nuevos materiales y recursos.",,,Kaneesha Parsard,@kaneeshaparsard,2020,
cds93,Maroon Country,,,,http://marooncountry.org,Collections & Curations,Thematic Curations,digital archive,a digital archive,un archivo digital,,open,Active,en,Schuyler Esprit ,Create Caribbean ,"Maroon Country is a multimedia educational resource focused on the history of maroons, the independent and resistant black communities of the slavery-era Caribbean.","Maroon Country is a multimedia educational resource focused on the history of maroons, the independent and resistant black communities of the slavery-era Caribbean.","El país cimarrón es un recurso educativo multimedia centrado en la historia de los cimarrones, las comunidades negras independientes y resistentes de la era de esclavitud caribeña.",,,Schuyler Esprit,@schuyleresprit,2020,
cds94,Library of Glissant Studies,,Biblioteca de Estudios Glissant,,https://www.glissantstudies.com/,Collections & Curations,Thematic Curations,a digital library,a digital library,una biblioteca digital,,open,Active,"en,fr",Raphaël Lauro and Jeanne Jégousso,,"The Library of Glissant Studies is a collective project which would not be possible without the help and support of dozen of dedicated individuals and institutions across the world. Our team aim at developing researches in the field of Glissant Studies by indexing information, and facilitating collaborations between scholars, students, and universities.","The Library of Glissant Studies is a collective project which would not be possible without the help and support of dozen of dedicated individuals and institutions across the world. Our team aim at developing researches in the field of Glissant Studies by indexing information, and facilitating collaborations between scholars, students, and universities.","La Biblioteca de Estudios Glissant es un proyecto colectivo que no sería posible sin la ayuda y el apoyo de docenas de individuos e instituciones dedicadas en todo el mundo. Nuestro equipo apunta a desarrollar investigaciones en el campo de los estudios de Glissant mediante la indexación de información y facilitando las colaboraciones entre los académicos, los estudiantes y las universidades.",,,Alex Gil,@elotroalex,2020,
cds95,Junkanoo in Grand Bahama,,,,https://junkanooingb.com/,Collections & Curations,Thematic Curations,an initial exploration,an initial exploration,una exploración inicial,,open,Active,en,Sally Everson,University of the Bahamas - North,"This project is the work of students of The University of The Bahamas-North, in English Studies courses. It is an initial exploration of Junkanoo in Grand Bahama, and aims to document the history, practices and participants of Junkanoo on the island of Grand Bahama.","This project is the work of students of The University of The Bahamas-North, in English Studies courses. It is an initial exploration of Junkanoo in Grand Bahama, and aims to document the history, practices and participants of Junkanoo on the island of Grand Bahama.","Este es un proyecto de los estudiantes de inglés de la Universidad del Bahamas-Norte. Es una exploración inicial de Junkanoo en Grand Bahama, y ​​tiene como objetivo documentar la historia, las prácticas y los participantes de Junkanoo en la isla de Grand Bahama.",,,Roopika Risam,@roopikarisam,2020,
cds96,Imagined Homeland: Dominica's Literary Geographies,,Patria imaginada: las geografías literarias de Dominica,,https://dominicadh.org/homeland/,Collections & Curations,Thematic Curations,a project,a project,un proyecto,,open,Active,en,Schuyler Esprit ,Create Caribbean,"Imagined Homeland (Dominica’s Literary Geographies) aims to digitally recreate significant historical locations referenced literature by Dominican authors and or set in Dominica through geographical mapping, literary and historical analysis and audiovisual exhibits. The project aims to contextualize the island’s complex literary history and to explore the significant sociopolitical contexts that influenced literature about Dominica’s dynamic physical and social geography.","Imagined Homeland (Dominica’s Literary Geographies) aims to digitally recreate significant historical locations referenced literature by Dominican authors and/or set in Dominica through geographical mapping, literary and historical analysis and audiovisual exhibits. The project aims to contextualize the island’s complex literary history and to explore the significant sociopolitical contexts that influenced literature about Dominica’s dynamic physical and social geography.","""Imagined Homeland"" (Patria Imaginada, las geografías literarias de Dominica) tiene como objetivo recrear digitalmente ubicaciones históricas significativas que aparecen en la literatura de los autores dominicanos, utilizando la asignación geográfica, el análisis literario e histórico y las exhibiciones audiovisuales. El objetivo del proyecto es contextualizar la compleja historia literaria de la isla y explorar los contextos sociopolíticos significativos que influyeron en la literatura sobre la dinámica geografía física y social de Dominica.",,,Schuyler Esprit,@schuyleresprit,2020,
cds97,Liberated Africans,,,,https://liberatedafricans.dev.matrix.msu.edu/,Collections & Curations,Thematic Curations,an exhibit,an exhibit,una exposición,,open,Active,en,Henry B. Lovejoy,"Matrix, Michigan State University","After 1807, over 250,000 people were involved in an international effort to abolish the Atlantic and Indian Ocean slave trades. This resource is dedicated to their memories.","After 1807, over 250,000 people were involved in an international effort to abolish the Atlantic and Indian Ocean slave trades. This resource is dedicated to their memories.","Después de 1807, más de 250,000 personas participaron en un esfuerzo internacional para abolir el comercio de esclavos del Océano Atlántico e Indio. Este recurso está dedicado a su memoria.",,,Roopika Risam,@roopikarisam,2020,
cds98,La Gazette Royale d'Haïti,The Royal Gazette of Haiti,La Gaceta real de Haití,,http://lagazetteroyale.com,Collections & Curations,Thematic Curations,digital archive,digital archive,archivo digital,,open,Active,"en,fr",Marlene L. Daut,,"The La Gazette Royale project, which I first began to develop in 2014, is designed to gather together and in one place for the first time all of the known issues of the two newspapers published during Henry Christophe’s rule of northern Haiti, as well as the six different versions of the Almanach Royal d’Hayti issued by the royal press.","The La Gazette Royale project, which began development in 2014, is designed to gather together and in one place for the first time all of the known issues of the two newspapers published during Henry Christophe’s rule of northern Haiti, as well as the six different versions of the Almanach Royal d’Hayti issued by the royal press.","El Proyecto La Gaceta Real, que comienza a desarrollarse en 2014, está diseñado para reunir en un solo lugar, y por primera vez, todos los números conocidos de los dos periódicos publicados durante el reino de Henry Christophe, así como la seis versiones diferentes del Almanaque Real de Haiti publicados por la Prensa Real.",,,Kaiama L. Glover,@inthewhirld,2020,
cds99,Puerto Rico Architectural Heritage Archive,,,,https://mellon.org/grants/grants-database/grants/fundacion-luis-munoz-marin-inc/2004-07580/,Collections & Curations,Thematic Curations,digital archive,a digital archive,un archivo digital,,open,In Development,"es,en",Jacqueline Hayden ,Fundación Luis Muñoz Marín,"The Puerto Rico Architectural Historic Archive will be an online digital repository of
architectural resources, whether documents, photographs, buildings and sites in Puerto
Rico. PRAHA is an alliance of six organizations that share a commitment towards the
conservation of architectural heritage: 1. public and private; Fundación Luis Muñoz
Marín (FLMM), Para la Naturaleza, and the Puerto Rico Historic Buildings Drawings
Society (PRHBDS) and 2. state and federal entities; the National Park Service (NPS),
the State Historic Preservation Office (SHPO), the Archivo de Arquitectura y
Construcción de la Universidad de Puerto Rico (AACUPR). Our goal is to share
technological infrastructure and distributed meta data across our six organizations to
further promote the visibility of our collective resources. Without the acknowledgement
of Vernacular, Afro Puerto Rican, rural, and barrio architecture, a panoramic view of the
history and definition of architecture as a cultural product remains incomplete. In this
project, such a stance will translate into the visualization, through photographic records,
of architectural styles, dwelling systems, and the working spaces of/for the historically
marginalized and silenced social groups.","The Puerto Rico Architectural Historic Archive will be an online digital repository of architectural resources, whether documents, photographs, buildings and sites in Puerto Rico. PRAHA is an alliance of six organizations that share a commitment towards the conservation of architectural heritage: 1. public and private; Fundación Luis Muñoz Marín (FLMM), Para la Naturaleza, and the Puerto Rico Historic Buildings Drawings Society (PRHBDS) and 2. state and federal entities; the National Park Service (NPS), the State Historic Preservation Office (SHPO), the Archivo de Arquitectura y Construcción de la Universidad de Puerto Rico (AACUPR). Our goal is to share technological infrastructure and distributed meta data across our six organizations to further promote the visibility of our collective resources. Without the acknowledgement of Vernacular, Afro Puerto Rican, rural, and barrio architecture, a panoramic view of the history and definition of architecture as a cultural product remains incomplete. In this project, such a stance will translate into the visualization, through photographic records, of architectural styles, dwelling systems, and the working spaces of/for the historically marginalized and silenced social groups.","El Archivo Histórico Arquitectónico de Puerto Rico será un repositorio digital en línea de Recursos arquitectónicos, ya sean documentos, fotografías, edificios y sitios en Puerto Rico. Praha es una alianza de seis organizaciones que comparten un compromiso con el Conservación del patrimonio arquitectónico: 1. Público y privado; FUNDACION LUIS MUÑOZ Marín (FLMM), para la Naturaleza, y los dibujos de edificios históricos de Puerto Rico. Sociedad (PRHBDS) y 2. Entidades estatales y federales; El Servicio Nacional del Parque (NPS), La Oficina de Preservación Histórica del Estado (SHPO), el Archivo de Arquitectura y Construcción de la Universidad de Puerto Rico  (AACUPR). Nuestro objetivo es compartir infraestructura tecnológica y metadatos distribuidos en nuestras seis organizaciones a Promover aún más la visibilidad de nuestros recursos colectivos. Sin el reconocimiento de arquitectura vernácula, afro puertorriqueña, rural y barrio, una vista panorámica de la La historia y la definición de arquitectura como un producto cultural sigue siendo incompleto. En esto Proyecto, tal postura se traducirá en la visualización, a través de registros fotográficos, de estilos arquitectónicos, sistemas de vivienda y los espacios de trabajo de / para los históricamente Grupos sociales marginados y silenciados.",,,Joshua Ortiz Baco,@jgob,2020,
