pid,label,label_en,label_es,label_fr,link,section,genre,claimed_genre,claimed_genre_en,claimed_genre_es,claimed_genre_fr,access,status,language,creators,stewards,blurb_orig,blurb_en,blurb_es,blurb_fr,related_to,added_by,twitter,census_year,notes
cds207,Bermuda 100: Visualizing Bermuda's Shipwrecks,,,,https://bermuda100.ucsd.edu/,Maps & Visualizations,Sui Generis,cultural heritage conservation,cultural heritage conservation,,,open,Active,en,https://bermuda100.ucsd.edu/people.php,UCSD,"Using advanced technology and tools to document, share and explore surrounding waters, the Bermuda 100 Challenge aims to create a marine heritage science and engineering methodology combining data acquisition, curation, analysis and dissemination. In doing so, the project will also construct the foundations of an ecosystem to enable continuous innovation. The reefs surrounding Bermuda are home to well over 100 shipwrecks in relatively shallow waters. Many surrounded by mystery and myth (think Bermuda Triangle), these sites are integral to the cultural heritage of this Atlantic outpost. Over the centuries, shipwrecks have become naturalized components of the benthic ecology – located on the bottom of the ocean – and these unique biological communities function as time capsules for the study of natural systems. Their stories tell of human ambition and courage as well as misadventure and tragedy, and they offer marine scientists new worlds of discovery. ","Using advanced technology and tools to document, share and explore surrounding waters, the Bermuda 100 Challenge aims to create a marine heritage science and engineering methodology combining data acquisition, curation, analysis and dissemination. In doing so, the project will also construct the foundations of an ecosystem to enable continuous innovation. The reefs surrounding Bermuda are home to well over 100 shipwrecks in relatively shallow waters. Many surrounded by mystery and myth (think Bermuda Triangle), these sites are integral to the cultural heritage of this Atlantic outpost. Over the centuries, shipwrecks have become naturalized components of the benthic ecology – located on the bottom of the ocean – and these unique biological communities function as time capsules for the study of natural systems. Their stories tell of human ambition and courage as well as misadventure and tragedy, and they offer marine scientists new worlds of discovery. ",,,,,,,
cds209,In the Streets of Le Cap,,,Dans les rues du Cap,https://streetsoflecap.com/,Maps & Visualizations,Maps,interactive map,interactive map,,carte interactive,open,Stable,"en,fr","Camille Cordier, Carrie Glenn",,"In the Streets of Le Cap give researchers and students the opportunity to visualize the demographic and economic transformation of Cap Français between the colonial and revolutionary eras. Our project is based on the georeferencing of data contained in three cadastres of Cap Français using GIS software. Drawing on these unpublished sources, one can draw up a precise map of the city and its populace in 1776 at the beginning of the American War for Independence, in 1787 just before the French Revolution, and in 1803, during the Haitian War of Independence. In the final version of our project, researchers will have direct access to an interactive map of the three cadastres as well as the raw data. Using these data, researchers will have the opportunity to retrace the trajectories of individuals and families, observe the social and racial configuration of the urban landscape, as well as analyze the overall dynamics of the city on a larger scale.","In the Streets of Le Cap give researchers and students the opportunity to visualize the demographic and economic transformation of Cap Français between the colonial and revolutionary eras. Our project is based on the georeferencing of data contained in three cadastres of Cap Français using GIS software. Drawing on these unpublished sources, one can draw up a precise map of the city and its populace in 1776 at the beginning of the American War for Independence, in 1787 just before the French Revolution, and in 1803, during the Haitian War of Independence. In the final version of our project, researchers will have direct access to an interactive map of the three cadastres as well as the raw data. Using these data, researchers will have the opportunity to retrace the trajectories of individuals and families, observe the social and racial configuration of the urban landscape, as well as analyze the overall dynamics of the city on a larger scale.",,"Notre projet offre l’opportunité au public de visualiser pour la première fois la transformation démographique et économique de la ville du Cap entre les périodes coloniale et révolutionnaire. Notre projet s’appuie sur le géoréférencement des données de trois cadastres du Cap-Français grâce à un logiciel SIG. A partir de ces sources inédites, il est possible de dresser une cartographie précise de la ville et sa population à trois dates clefs de l’histoire de la colonie, en 1776 aux prémices de la guerre d’indépendance américaine, en 1787 à la veille de la Révolution française, et en 1803, au cœur de la guerre d’indépendance haïtienne. Dans la version finale de notre projet, les chercheurs auront un accès direct à une carte interactive des trois cadastres, ainsi qu’à la base de données brute. Ils pourront à la fois retracer le parcours d’individus ou de familles, observer l’inscription différenciée des groupes sociaux-raciaux dans le paysage urbain, ainsi qu’analyser les dynamiques globales de la ville, à une échelle plus large. ",,,,,Broken link on the fr homepage.
cds213,Visualizing the Data of the Eighteenth Century French Caribbean,,,,https://blogs.baruch.cuny.edu/mappingthefrenchcaribbean/,Maps & Visualizations,Mixed Genres,,,,,open,In Development,en,"Elizabeth Heath, Julia Landweber",,"Visualizing the Data of the Eighteenth Century French Caribbean offers contemporary researchers the opportunity to use the same census records and historical maps commissioned by the French royal government to analyze the dynamic transformations that occurred in the Caribbean colonies in fine detail. It does so by providing these sources in formats suited to today’s digital and visual technologies. When complete, the database and website will offer scholars open access to eighteenth century census records of the French Caribbean in digital formats that can be used alone or with georeferenced historical maps and GIS software. Equally important, the project will provide scholarly tools that will help investigators better understand the ways these sources blurred the imaginary and the objective quantitatively and visually, but with real-life implications for those who lived and toiled in the colonies. Together these digital formats and analytical resources will allow scholars at all levels to assess, visualize, and critically analyze the demographic and economic changes that occurred in the eighteenth century French Caribbean and generate new understandings of this revolutionary era and region.","Visualizing the Data of the Eighteenth Century French Caribbean offers contemporary researchers the opportunity to use the same census records and historical maps commissioned by the French royal government to analyze the dynamic transformations that occurred in the Caribbean colonies in fine detail. It does so by providing these sources in formats suited to today’s digital and visual technologies. When complete, the database and website will offer scholars open access to eighteenth century census records of the French Caribbean in digital formats that can be used alone or with georeferenced historical maps and GIS software. Equally important, the project will provide scholarly tools that will help investigators better understand the ways these sources blurred the imaginary and the objective quantitatively and visually, but with real-life implications for those who lived and toiled in the colonies. Together these digital formats and analytical resources will allow scholars at all levels to assess, visualize, and critically analyze the demographic and economic changes that occurred in the eighteenth century French Caribbean and generate new understandings of this revolutionary era and region.",,,,,,,
cds214,Cüirtopia,,Cüirtopia,,https://www.cuirtopia.xyz/,Maps & Visualizations,Maps,mapping project,mapping project,proyecto de cartografía,,open,Stable,"en,es",Regner Ramos,,"Cüirtopia is a mapping project that reimagines how we register, represent, and document queer spaces in the Caribbean. As an interactive map where a digital avatar called ""Konpa"" interviews users to ask them what they know, it is the only architectural and urban register of LGBTQ+ spaces in Puerto Rico. By recognizing LBGTQ+ spaces within contemporary cartographic practices, “Cüirtopia” inserts the buildings and territories that are significant to the queer community into the island’s architectural history, cultural infrastructure, urban memory, and political future. The map is both: an archival artifact and a speculative research method, testing innovative approaches between urban field research and socially oriented GIS technologies. ""Cüirtopia"" exists across a variety of formats and iterations: this map; an exhibition at the Museo de Arte Contemporáneo de Puerto Rico; a short film at the MAXXI in Rome; a radio show; a fictional story told via Instagram; community events; architecture courses at the UPR; site-based installations; and more. It was funded by the FIPI Award (2020-2022) at the University of Puerto Rico Río Piedras, and is led by Dr. Regner Ramos.","Cüirtopia is a mapping project that reimagines how we register, represent, and document queer spaces in the Caribbean. As an interactive map where a digital avatar called ""Konpa"" interviews users to ask them what they know, it is the only architectural and urban register of LGBTQ+ spaces in Puerto Rico. By recognizing LBGTQ+ spaces within contemporary cartographic practices, “Cüirtopia” inserts the buildings and territories that are significant to the queer community into the island’s architectural history, cultural infrastructure, urban memory, and political future. The map is both: an archival artifact and a speculative research method, testing innovative approaches between urban field research and socially oriented GIS technologies. ""Cüirtopia"" exists across a variety of formats and iterations: this map; an exhibition at the Museo de Arte Contemporáneo de Puerto Rico; a short film at the MAXXI in Rome; a radio show; a fictional story told via Instagram; community events; architecture courses at the UPR; site-based installations; and more. It was funded by the FIPI Award (2020-2022) at the University of Puerto Rico Río Piedras, and is led by Dr. Regner Ramos.","Cüirtopia es un proyecto de cartografía que reimagina cómo registramos, representamos y documentamos espacios queer en el Caribe. A través de un avatar llamado ""Konpa"" que entrevista a lxs usuarixs, este mapa interactivo es el único registro arquitectónico y urbano de espacios LGBTTI+ en Puerto Rico. Al reconocer los espacios LGBTT dentro de las prácticas cartográficas contemporáneas, ""Cüirtopia"" inserta los edificios y territorios que son importantes para la comunidad cüir en la historia de la arquitectura, la infraestructura cultural, la memoria urbana y el futuro político de la isla. El mapa es a la vez: un artefacto de archivo y un método de investigación especulativa, que prueba enfoques innovadores entre la investigación de campo urbano y las tecnologías SIG de orientación social. ""Cüirtopia"" existe a través de una variedad de formatos e iteraciones: este mapa; una exhibición en el Museo de Arte Contemporáneo de Puerto Rico; un cortometraje en MAXXI en Roma; un programa de radio; una historia de ficción narrada en Instagram; eventos comunitarios; cursos en la Universidad de Puerto Rico; instalaciones in-situ; y más. El proyecto está financiado por los Fondos Institucionales Para la Investigación en la Universidad de Puerto Rico, y lo dirige el Dr. Regner Ramos.",,,,,,
cds220,First International Relay,,,,http://odeiminrunners.ca/firm/,Maps & Visualizations,Mixed Genres,Socially engaged art; Digital humanities project,,,,open,In Disrepair,en,,,,,,,,,,,There's not a lot of information about this project. Not sure who to credit or what the blurb is.
cds221,"Art, Enslavement, and Resistance in Cap-Français",,,,https://storymaps.arcgis.com/stories/e0903bfa4cf749ce8ee68ecc69bcb0c4,Maps & Visualizations,Maps,digital mapping,digital mapping,,,open,Stable,en,Meredith Martin,,"A semester-long research project by students enrolled in the Institute of Fine Arts Fall 2023 seminar ""French Art, Colonialism, and Enslavement ca. 1660-1830."" ","A semester-long research project by students enrolled in the Institute of Fine Arts Fall 2023 seminar ""French Art, Colonialism, and Enslavement ca. 1660-1830."" ",,,,,,,
cds1,archipelagos journal,,Revista archipelagos,,http://archipelagosjournal.org/,Periodicals & Blogs,Journals,an academic journal,an academic journal,una revista académica,,open,Active,"en,fr,es","Kaiama Glover, Alex Gil",Columbia University Library,"archipelagos is a born-digital, peer-reviewed publication devoted to creative exploration, debate, and critical thinking about and through digital practices in contemporary scholarly and artistic work in and on the Caribbean. Given the wide implications of the “digital turn” for our very conceptions of knowledge, our mission is to discern the ways in which the digital may enhance and transform our comprehension of the regional and diasporic Caribbean. archipelagos responds to this challenge with three distinct dimensions of critical production: scholarly essays; digital scholarship projects; and digital project reviews.","<em>archipelagos</em> is a born-digital, peer-reviewed publication devoted to creative exploration, debate, and critical thinking about and through digital practices in contemporary scholarly and artistic work in and on the Caribbean. Given the wide implications of the “digital turn” for our very conceptions of knowledge, our mission is to discern the ways in which the digital may enhance and transform our comprehension of the regional and diasporic Caribbean. archipelagos responds to this challenge with three distinct dimensions of critical production: scholarly essays; digital scholarship projects; and digital project reviews.","<em>archipelagos</em> es una publicación nacida en linea y revisada por pares dedicada a la exploración, debate y pensamiento crítico creativo sobre y a través de prácticas digitales en el trabajo académico y artístico contemporáneo en el Caribe. Dadas las amplias implicaciones del &quot;giro digital&quot; para nuestras mismas concepciones del conocimiento, nuestra misión es discernir las formas en que lo digital puede mejorar y transformar nuestra comprensión del Caribe regional y diásporo. <em>archipelagos</em> responde a este desafío con tres dimensiones distintas de la producción crítica: ensayos académicos; proyectos digitales; y reseñas de proyectos digitales.",,,Alex Gil,@elotroalex,2020,
cds112,Manioc Blog,,,,http://manioc-blog.blogspot.com/,Periodicals & Blogs,Blogs,a blog,a blog,un blog,,open,Active,fr,,,"Digital library: Caribbean, Amazonia, Guyana","Digital library of the Caribbean, Amazonia, Guyana","Biblioteca digital del Caribe, Amazonia y Guyana.",,,,,2020,
cds115,Plenamar,Full tide,,,https://plenamar.do/,Periodicals & Blogs,Magazines,an online cultural magazine,an online cultural magazine,una revista cultural en línea,,open,Active,es,"Minerva del Risco,Rafael Emilio Yunén, Fausto Rosario, José Mármol and Jochy Herrera",Acento.com.do,"Published weekly, Plenamar is a Dominican-based online magazine focused on local and international cultural production.","Published weekly, Plenamar is a Dominican-based online magazine focused on local and international cultural production.","Publicado semanalmente, <em>Plenamar</em> es una revista en línea basada en República Dominicana centrada en la producción cultural local e internacional.",,,,,2020,
cds117,Latino Genealogy & Beyond: diasporic journeys across time and space,,Genealogía latina y más allá: viajes diáspóricos a lo largo del tiempo y el espacio,,https://latinogenealogyandbeyond.com,Periodicals & Blogs,Blogs,blogs,blogs,blogs,,open,Active,en,Ellen Fernandez-Sacco,,"Mabrika! Join me, Ellen Fernandez-Sacco as I research ancestors and discuss genealogy research with a Caribbean focus.","Mabrika! Join me, Ellen Fernandez-Sacco as I research ancestors and discuss genealogy research with a Caribbean focus.","¡Mabrika! Únete a mí, Ellen Fernández-Sacco, mientras investigo a los antepasados ​​y discuto la investigación de la genealogía con un enfoque caribeño.",,,Ellen Fernandez-Sacco,@efsacco,2020,
cds119,sx salon,,salón sx,,http://smallaxe.net/sxsalon,Periodicals & Blogs,Journals,a journal,a journal,un diario,,open,Active,en,Kelly Baker Josephs,Small Axe,"Our digital forum for innovative critical and creative explorations of Caribbean literature, broadly defined. Caribbean creative writing has always wrestled with the idea of an aesthetic form that engages regional and diasporic understandings of our changing realities. As a forum, sx salon aims to stimulate these sensibilities and preoccupations across different literary genres. Initiated in 2010, sx salon appears three times per year (February, June, and October). We publish literary discussions, interviews with writers, reviews of new publications (creative and scholarly), and poetry and prose by Caribbean writers.","Our digital forum for innovative critical and creative explorations of Caribbean literature, broadly defined. Caribbean creative writing has always wrestled with the idea of an aesthetic form that engages regional and diasporic understandings of our changing realities. As a forum, sx salon aims to stimulate these sensibilities and preoccupations across different literary genres. Initiated in 2010, sx salon appears three times per year (February, June, and October). We publish literary discussions, interviews with writers, reviews of new publications (creative and scholarly), and poetry and prose by Caribbean writers.","Nuestro foro digital para exploraciones críticas y creativas innovadoras de la literatura caribeña, ampliamente definida. La escritura creativa del Caribe siempre ha luchado con la idea de una forma estética que involucra a los entendimientos regionales y diáspóricos de nuestras realidades cambiantes. Como foro, sx salon apunta a estimular estas sensibilidades y preocupaciones en diferentes géneros literarios. Iniciado en 2010, sx salon aparece tres veces al año (febrero, junio y octubre). Publicamos discusiones literarias, entrevistas con escritores, revisiones de nuevas publicaciones (creativas y académicas), y poesía y prosa de los escritores del Caribe.",,,Alex Gil,@elotroalex,2020,
cds128,Tan Listwa,The Hobby,El pasatiempo,,https://tanlistwa.com/,Periodicals & Blogs,Blogs,a blog,a blog,un blog,,open,Active,"en,fr",Jessica Pierre-Louis,,"Welcome to the Martinican company Tan Listwa. As a historian, I provide you with the skills of a researcher and a trainer in humanities studies. Specialised in history and heritage of the Caribbean, I carry out missions of research engineering, training, and assistance for your genealogical research.","Beyond the services I offer on <em>Tan Listwa</em>, I wanted to share my research on the history and heritage of the Caribbean through my own discoveries: the pleasure of getting hold of an unknown archive, the excitement of discovering a story, the jubilation of reading between the lines, the frenzy of data accumulation and analysis, the satisfaction of better understanding the human past. So I created the blog <em>Le Passe-temps</em>: a space to exchange cool web links, to tell you historical anecdotes, to marvel at archives and heritage, to know our ancestors and not to forget their history.","Más allá de los servicios que ofrezco en <em>Tan Listwa</em>, quería compartir mi investigación sobre la historia y el patrimonio del Caribe a través de mis propios descubrimientos: el placer de hacerme con un archivo desconocido, la emoción de descubrir una historia, el júbilo de leer entre las líneas, el frenesí de la acumulación y el análisis de datos, la satisfacción de comprender mejor el pasado humano. Así que creé el blog </em>Le Passe-temps</em>: un espacio para intercambiar interesantes enlaces web, contarte anécdotas históricas, maravillarte con los archivos y el patrimonio, conocer a nuestros antepasados ​​y no olvidar su historia.",,,,,2020,
cds131,Repeating Islands,,Las islas que se repiten,,https://repeatingislands.com/,Periodicals & Blogs,Blogs,a blog,a blog,un blog,,open,Active,en,"Ivette Romero-Cesareo, Lisa Paravisini-Gebert",,"News and commentary on Caribbean culture, literature, and the arts","News and commentary on Caribbean culture, literature, and the arts","Noticias y comentarios sobre la cultura del Caribe, la literatura y las artes.",,,Roopika Risam,@roopikarisam,2020,
cds15,Arquitecture of necessity/Arquitectura de la necesidad,Arquitecture of necessity,Arquitectura de la necesidad,,http://architectureofnecessity.com/,Periodicals & Blogs,Blogs,blog,a blog,un blog,,open,Archived,es,Ernesto Oroza,,Architecture of Necessity is a concept with a double function. It initially operates as a descriptive and austere term in its rhetorical value that points to an architecture of urgency and precariousness. Its second and most important function is metaphorical: it enunciates an architecture that is its own diagram.,Architecture of Necessity is a concept with a double function. It initially operates as a descriptive and austere term in its rhetorical value that points to an architecture of urgency and precariousness. Its second and most important function is metaphorical: it enunciates an architecture that is its own diagram.,La arquitectura de la necesidad es un concepto con una doble función. Inicialmente funciona como un término descriptivo y austero en su valor retórico que apunta a una arquitectura de urgencia y precariedad. Su segunda y más importante función es metafórica: enuncia una arquitectura que es su propio diagrama.,,,,,2020,
cds156,The Public Archive,,El archivo público,,https://thepublicarchive.com,Periodicals & Blogs,Blogs,blog,a blog,un blog,,open,Stable,en,Peter Hudson,,"In light of this obliteration of history, The Public Archive was initiated to serve as an accessible clearinghouse of historical essays, archival sources, and informed contemporary journalism on Haiti. The Public Archive compiles links to documents freely accessible through the digital collections of libraries and repositories as well as open-access online periodicals, academic journals and newspapers.","In light of this obliteration of history, The Public Archive was initiated to serve as an accessible clearinghouse of historical essays, archival sources, and informed contemporary journalism on Haiti. The Public Archive compiles links to documents freely accessible through the digital collections of libraries and repositories as well as open-access online periodicals, academic journals and newspapers.","A la luz de la perdida de documentos historicos, se inició el archivo público para servir como un reclamo accesible de ensayos históricos, fuentes de archivo e informó el periodismo contemporáneo en Haití. El archivo público recopila enlaces a documentos de forma gratuita a través de las colecciones digitales de bibliotecas y repositorios, así como publicaciones periódicas en línea de acceso abierto, revistas académicas y periódicos.",,,Kaiama L. Glover,@inthewhirld,2020,
